{"version": "1.0.0", "Document": {"PricRpt": {"Fctn": "NEWP", "MsgId": {"Id": "AU60ETL93373-20261014", "CreDtTm": "2026-10-14T00:00:00Z"}, "MsgPgntn": {"PgNb": "1", "LastPgInd": true}, "PricRptId": "AU60ETL93373-20261014", "PricValtnDtls": [{"TtlNAV": [{"Ccy": "AUD", "value": 702828.71}], "NAVDtTm": {"Dt": "2026-10-14"}, "SspdInd": false, "ValtnTp": "USUA", "PricDtls": [{"PricTp": {"Cd": "NAVL"}, "CumDvddInd": false, "ForExctnInd": false, "EstmtdPricInd": false, "ValInInvstmtCcy": [{"Amt": {"Ccy": "AUD", "value": 1.1509}}]}, {"PricTp": {"Cd": "OFFR"}, "CumDvddInd": false, "ForExctnInd": true, "EstmtdPricInd": false, "ValInInvstmtCcy": [{"Amt": {"Ccy": "AUD", "value": 1.1517}}]}, {"PricTp": {"Cd": "BIDE"}, "CumDvddInd": false, "ForExctnInd": true, "EstmtdPricInd": false, "ValInInvstmtCcy": [{"Amt": {"Ccy": "AUD", "value": 1.1501}}]}], "ValtnFrqcy": "DAIL", "ValtnSttstcs": [{"Ccy": "AUD", "PricChng": {"Amt": 0.0133, "Rate": -0.011424, "AmtSgn": true}, "ByPrdfndTmPrds": {"LwstPricVal12Mnths": {"Amt": {"Ccy": "AUD", "value": 0.9997}}, "HghstPricVal12Mnths": {"Amt": {"Ccy": "AUD", "value": 1.1650}}}, "ByUsrDfndTmPrd": [{"Prd": {"Dt": {"FrDt": "2026-09-14", "ToDt": "2026-10-14"}}, "PricChng": {"Amt": 0.0202, "Rate": 0.017865, "AmtSgn": false}}, {"Prd": {"Dt": {"FrDt": "2026-07-16", "ToDt": "2026-10-14"}}, "PricChng": {"Amt": 0.0357, "Rate": 0.032012, "AmtSgn": false}}, {"Prd": {"Dt": {"FrDt": "2026-04-17", "ToDt": "2026-10-14"}}, "PricChng": {"Amt": 0.1039, "Rate": 0.099236, "AmtSgn": false}}], "PricTpChngBsis": {"Strd": "NAVL"}}], "FinInstrmDtls": {"Id": [{"ISIN": "AU60ETL93373"}, {"OthrPrtryId": {"Id": "BBG022MMSXM3", "IdSrc": {"Prtry": "FIGI"}}}], "Nm": "FT Capital Multi Class Investment Fund - US Large Cap Enhanced Complex Class", "DualFndInd": false}, "OffclValtnInd": true}]}}, "generatedAt": "2026-10-15T08:11:36Z", "authoritative": true, "schema_version": "1.0.0"}
